[
  {
    "vector_id": "guitar-open-e2",
    "instrument_id": "guitar-standard-6",
    "phase": "do-003-candidate-generation",
    "tags": [
      "standard-guitar",
      "open-string"
    ],
    "inputs": {
      "event": {
        "midi_note": 40,
        "cents_offset": 0.0
      },
      "preferences": {}
    },
    "expected": {
      "generation": {
        "candidates": [
          {
            "string_id": "string-6",
            "course_id": null,
            "display_order": 0,
            "sounding_midi_note": 40,
            "cents_offset": 0.0,
            "relative_semitone_position": 0.0,
            "physical_semitone_position_from_nut": 0.0,
            "physical_fret_number": 0,
            "reference_type": "physical_fret",
            "normalized_position": 0.0,
            "distance_from_nut_mm": 0.0,
            "is_open_string": true
          }
        ]
      },
      "selection": {
        "status": "reserved",
        "reason": "requires DO-004 deterministic selection"
      }
    }
  },
  {
    "vector_id": "guitar-open-a2",
    "instrument_id": "guitar-standard-6",
    "phase": "do-003-candidate-generation",
    "tags": [
      "standard-guitar",
      "open-string"
    ],
    "inputs": {
      "event": {
        "midi_note": 45,
        "cents_offset": 0.0
      },
      "preferences": {}
    },
    "expected": {
      "generation": {
        "candidates": [
          {
            "string_id": "string-6",
            "course_id": null,
            "display_order": 0,
            "sounding_midi_note": 45,
            "cents_offset": 0.0,
            "relative_semitone_position": 5.0,
            "physical_semitone_position_from_nut": 5.0,
            "physical_fret_number": 5,
            "reference_type": "physical_fret",
            "normalized_position": 0.250846461562,
            "distance_from_nut_mm": 162.548507091955,
            "is_open_string": false
          },
          {
            "string_id": "string-5",
            "course_id": null,
            "display_order": 1,
            "sounding_midi_note": 45,
            "cents_offset": 0.0,
            "relative_semitone_position": 0.0,
            "physical_semitone_position_from_nut": 0.0,
            "physical_fret_number": 0,
            "reference_type": "physical_fret",
            "normalized_position": 0.0,
            "distance_from_nut_mm": 0.0,
            "is_open_string": true
          }
        ]
      },
      "selection": {
        "status": "reserved",
        "reason": "requires DO-004 deterministic selection"
      }
    }
  },
  {
    "vector_id": "guitar-multi-g3",
    "instrument_id": "guitar-standard-6",
    "phase": "do-003-candidate-generation",
    "tags": [
      "standard-guitar",
      "multiple-playable-positions"
    ],
    "inputs": {
      "event": {
        "midi_note": 55,
        "cents_offset": 0.0
      },
      "preferences": {}
    },
    "expected": {
      "generation": {
        "candidates": [
          {
            "string_id": "string-6",
            "course_id": null,
            "display_order": 0,
            "sounding_midi_note": 55,
            "cents_offset": 0.0,
            "relative_semitone_position": 15.0,
            "physical_semitone_position_from_nut": 15.0,
            "physical_fret_number": 15,
            "reference_type": "physical_fret",
            "normalized_position": 0.579551792373,
            "distance_from_nut_mm": 375.549561457797,
            "is_open_string": false
          },
          {
            "string_id": "string-5",
            "course_id": null,
            "display_order": 1,
            "sounding_midi_note": 55,
            "cents_offset": 0.0,
            "relative_semitone_position": 10.0,
            "physical_semitone_position_from_nut": 10.0,
            "physical_fret_number": 10,
            "reference_type": "physical_fret",
            "normalized_position": 0.438768975845,
            "distance_from_nut_mm": 284.322296347763,
            "is_open_string": false
          },
          {
            "string_id": "string-4",
            "course_id": null,
            "display_order": 2,
            "sounding_midi_note": 55,
            "cents_offset": 0.0,
            "relative_semitone_position": 5.0,
            "physical_semitone_position_from_nut": 5.0,
            "physical_fret_number": 5,
            "reference_type": "physical_fret",
            "normalized_position": 0.250846461562,
            "distance_from_nut_mm": 162.548507091955,
            "is_open_string": false
          },
          {
            "string_id": "string-3",
            "course_id": null,
            "display_order": 3,
            "sounding_midi_note": 55,
            "cents_offset": 0.0,
            "relative_semitone_position": 0.0,
            "physical_semitone_position_from_nut": 0.0,
            "physical_fret_number": 0,
            "reference_type": "physical_fret",
            "normalized_position": 0.0,
            "distance_from_nut_mm": 0.0,
            "is_open_string": true
          }
        ]
      },
      "selection": {
        "status": "reserved",
        "reason": "requires DO-004 deterministic selection"
      }
    }
  },
  {
    "vector_id": "guitar-multi-e4",
    "instrument_id": "guitar-standard-6",
    "phase": "do-003-candidate-generation",
    "tags": [
      "standard-guitar",
      "multiple-playable-positions"
    ],
    "inputs": {
      "event": {
        "midi_note": 64,
        "cents_offset": 0.0
      },
      "preferences": {}
    },
    "expected": {
      "generation": {
        "candidates": [
          {
            "string_id": "string-5",
            "course_id": null,
            "display_order": 1,
            "sounding_midi_note": 64,
            "cents_offset": 0.0,
            "relative_semitone_position": 19.0,
            "physical_semitone_position_from_nut": 19.0,
            "physical_fret_number": 19,
            "reference_type": "physical_fret",
            "normalized_position": 0.666290036457,
            "distance_from_nut_mm": 431.755943624454,
            "is_open_string": false
          },
          {
            "string_id": "string-4",
            "course_id": null,
            "display_order": 2,
            "sounding_midi_note": 64,
            "cents_offset": 0.0,
            "relative_semitone_position": 14.0,
            "physical_semitone_position_from_nut": 14.0,
            "physical_fret_number": 14,
            "reference_type": "physical_fret",
            "normalized_position": 0.55455064093,
            "distance_from_nut_mm": 359.34881532253,
            "is_open_string": false
          },
          {
            "string_id": "string-3",
            "course_id": null,
            "display_order": 3,
            "sounding_midi_note": 64,
            "cents_offset": 0.0,
            "relative_semitone_position": 9.0,
            "physical_semitone_position_from_nut": 9.0,
            "physical_fret_number": 9,
            "reference_type": "physical_fret",
            "normalized_position": 0.405396442499,
            "distance_from_nut_mm": 262.696894739118,
            "is_open_string": false
          },
          {
            "string_id": "string-2",
            "course_id": null,
            "display_order": 4,
            "sounding_midi_note": 64,
            "cents_offset": 0.0,
            "relative_semitone_position": 5.0,
            "physical_semitone_position_from_nut": 5.0,
            "physical_fret_number": 5,
            "reference_type": "physical_fret",
            "normalized_position": 0.250846461562,
            "distance_from_nut_mm": 162.548507091955,
            "is_open_string": false
          },
          {
            "string_id": "string-1",
            "course_id": null,
            "display_order": 5,
            "sounding_midi_note": 64,
            "cents_offset": 0.0,
            "relative_semitone_position": 0.0,
            "physical_semitone_position_from_nut": 0.0,
            "physical_fret_number": 0,
            "reference_type": "physical_fret",
            "normalized_position": 0.0,
            "distance_from_nut_mm": 0.0,
            "is_open_string": true
          }
        ]
      },
      "selection": {
        "status": "reserved",
        "reason": "requires DO-004 deterministic selection"
      }
    }
  },
  {
    "vector_id": "guitar-unplayable-high",
    "instrument_id": "guitar-standard-6",
    "phase": "do-003-candidate-generation",
    "tags": [
      "standard-guitar",
      "no-playable-position"
    ],
    "inputs": {
      "event": {
        "midi_note": 100,
        "cents_offset": 0.0
      },
      "preferences": {}
    },
    "expected": {
      "generation": {
        "candidates": []
      },
      "selection": {
        "status": "reserved",
        "reason": "requires DO-004 deterministic selection"
      }
    }
  },
  {
    "vector_id": "guitar-capo-d4",
    "instrument_id": "guitar-standard-6",
    "phase": "do-003-candidate-generation",
    "tags": [
      "standard-guitar",
      "capo-behavior"
    ],
    "inputs": {
      "event": {
        "midi_note": 62,
        "cents_offset": 0.0
      },
      "constraints": {
        "capo_position": 2.0
      },
      "preferences": {}
    },
    "expected": {
      "generation": {
        "candidates": [
          {
            "string_id": "string-6",
            "course_id": null,
            "display_order": 0,
            "sounding_midi_note": 62,
            "cents_offset": 0.0,
            "relative_semitone_position": 20.0,
            "physical_semitone_position_from_nut": 22.0,
            "physical_fret_number": 22,
            "reference_type": "physical_fret",
            "normalized_position": 0.719384487923,
            "distance_from_nut_mm": 466.161148173882,
            "is_open_string": false
          },
          {
            "string_id": "string-5",
            "course_id": null,
            "display_order": 1,